{
  "name": "rfc2369-both-prefer-mailto",
  "description": "List-Unsubscribe contains both mailto and https; without a one-click Post header, mailto is preferred.",
  "spec": {
    "source": "RFC 2369",
    "url": "https://www.rfc-editor.org/rfc/rfc2369#section-3.2",
    "behavior": "When both mailto and http are offered, the crate prefers mailto because it does not require a browser session. Documented in the README under 'Intentional divergences'."
  },
  "input": {
    "list_unsubscribe": "<mailto:u@example.com>, <https://example.com/unsub>",
    "list_unsubscribe_post": null
  },
  "expected": {
    "kind": "Mailto",
    "address": "u@example.com",
    "subject": null
  }
}
